{
  "description": "The DKC (Dunning-Kruger Coding) detection ruleset. 56 rules across 7 weighted categories that identify code shipped without adequate understanding. Severity is derived from category weight: comment forensics and LLM fingerprints (0.10) lean medium, dependency and developer-experience signals (0.12-0.13) lean high, infrastructure (0.18) and security anti-patterns (0.25) lean critical, social/meta signals (0.07) lean low. Final score is domain-adjusted by application context.",
  "icon": "scale",
  "kill_chain_order": {
    "vantacode-dkc": [
      "security-anti-patterns",
      "infrastructure-red-flags",
      "developer-signals",
      "outdated-versions",
      "comment-forensics",
      "llm-fingerprints",
      "social-signals"
    ]
  },
  "name": "VantaCode DKC Rules",
  "namespace": "vantacode",
  "type": "vantacode-dkc-rules",
  "uuid": "d3f6a89c-5e44-4cf3-be21-3d4c6f7e9fa3",
  "version": 1
}
